project,low_risk,intermediate_risk,high_risk
PAAD,"Lower survival risk in pancreatic adenocarcinoma is typically associated with several histopathological and clinical features observed in the primary tumor. These include a lower TMN stage, indicating smaller tumor size and limited lymph node involvement. The absence of lymphovascular invasion (LVI) and perineural invasion (PNI) is also a significant factor, as these suggest the tumor has not yet spread to surrounding tissues or nerves. Tumors with well-defined and non-infiltrative margins, low nuclear atypia, and minimal desmoplastic reaction also contribute to a more favorable prognosis. Furthermore, the absence of necrosis and debris in the tumor microenvironment indicates a less aggressive tumor behavior, which correlates with better survival outcomes.","A medium survival risk in pancreatic adenocarcinoma typically involves intermediate TMN stages, where the tumor may have grown moderately in size and may have started to involve some lymph nodes, but not extensively. The presence of mild lymphovascular invasion (LVI) and perineural invasion (PNI) suggests some degree of tumor spread, but not as aggressively as in higher-risk cases. Tumor margins may show partial infiltration, and there may be moderate nuclear atypia and desmoplastic reaction. Some necrosis or cellular debris might be present, indicating areas of the tumor with more aggressive features, but overall, the tumor exhibits a mixed pattern of both aggressive and more indolent behavior, leading to an intermediate survival risk.","Higher survival risk in pancreatic adenocarcinoma is associated with advanced TMN stages, where the tumor is large, extensively involves regional lymph nodes, and may have metastasized to distant sites. Histologically, these tumors typically show pronounced lymphovascular invasion (LVI) and perineural invasion (PNI), indicating aggressive spreading behavior. The tumor margins are often poorly defined and highly infiltrative, with high nuclear atypia and extensive desmoplastic reaction, reflecting a disorganized and rapidly proliferating tumor. Additionally, significant areas of necrosis and cellular debris within the tumor microenvironment suggest high tumor turnover and poor differentiation, all of which correlate with a poor prognosis and lower survival outcomes."
READ,"Lower survival risk in Rectum adenocarcinoma is generally associated with early-stage TMN classifications, such as T1 or early T2, where the tumor is confined to the rectal wall and has not invaded beyond the submucosa. Lymphovascular invasion (LVI) and perineural invasion (PNI) are typically absent, indicating a lower likelihood of metastatic spread. The tumor cells are usually well-differentiated, forming organized glandular structures with minimal nuclear atypia, which reflects a less aggressive tumor phenotype. Tumor margins are often well-defined, with a limited inflammatory response and minimal stromal reaction, suggesting that the body's immune system has effectively contained the tumor. The absence of necrosis and debris further indicates a favorable prognosis, contributing to a lower overall survival risk.","Medium survival risk in Rectum adenocarcinoma typically corresponds to intermediate TMN stages, such as T2 or early T3, where the tumor invades the muscularis propria but has not yet penetrated deeply into adjacent structures. Lymphovascular invasion (LVI) may be present but is often less extensive compared to higher-risk cases, and perineural invasion (PNI) might be focal or minimal. Tumor cells may display moderate differentiation with a mix of well-formed and irregular glandular structures, accompanied by moderate nuclear atypia. The tumor margins might be partially infiltrative, and the inflammatory response is often moderate, reflecting a tumor that is still responsive to the body's immune system. While these features indicate some level of risk, they suggest a more balanced prognosis, with potential for both survival and progression depending on other clinical factors.","Higher survival risk in Rectum adenocarcinoma is often associated with advanced TMN stages, such as T3 or T4, indicating deep invasion into the muscular layers or beyond the rectal wall. The presence of lymphovascular invasion (LVI) and perineural invasion (PNI) further exacerbates the risk, as these features suggest the potential spread of cancer cells through lymphatic vessels and nerves, respectively. Histopathologically, the tumor might exhibit high-grade features with poorly differentiated cells, significant nuclear atypia, and an infiltrative growth pattern. The presence of necrosis, debris, and areas of hypoxia within the tumor can also indicate a more aggressive and lethal cancer. These features collectively point towards a higher survival risk due to their association with aggressive tumor behavior and potential metastasis."
SKCM,"Lower survival risk in Skin Cutaneous Melanoma is typically associated with features such as thin tumor depth (low Breslow thickness), low Clark level (indicating minimal invasion into the dermis), the absence of ulceration, and no evidence of lymphovascular invasion (LVI) or perineural invasion (PNI). These tumors generally exhibit low mitotic rates and well-organized cellular structures, with minimal evidence of necrosis or inflammatory response. The TNM stage would be lower, often classified as Stage I, indicating localized disease without metastasis to lymph nodes or distant organs.","Medium survival risk in Skin Cutaneous Melanoma may be suggested by features such as intermediate tumor thickness (moderate Breslow depth) and a higher Clark level, where the tumor has penetrated into the reticular dermis but not beyond. There may be the presence of ulceration and a moderate mitotic rate. The tumor margins might show some irregularities, and there could be evidence of lymphovascular invasion (LVI) or perineural invasion (PNI). The TNM stage would likely be around Stage II, with possible involvement of regional lymph nodes but no distant metastasis. A moderate inflammatory response and some necrosis might also be present.","Higher survival risk in Skin Cutaneous Melanoma is characterized by features such as a thick tumor (high Breslow thickness) and a high Clark level, indicating deep invasion into the subcutaneous tissue or beyond. The presence of extensive ulceration, a high mitotic rate, and irregular or infiltrative tumor margins are also common. Lymphovascular invasion (LVI) and perineural invasion (PNI) are often present, with significant evidence of necrosis and a pronounced inflammatory response. The TNM stage would typically be higher, such as Stage III or IV, with regional lymph node involvement and possibly distant metastasis, indicating a more advanced and aggressive disease."
UCEC,"Lower survival risk in Uterine Corpus Endometrial Carcinoma is associated with more favorable pathological features observed in WSIs. The tumor is usually low-grade, with well-differentiated cells that resemble normal endometrial tissue, exhibiting minimal nuclear atypia and low mitotic activity. Tumor size is generally smaller, and there is limited or no myometrial invasion, with well-defined tumor margins that do not show extensive infiltration. The absence of lymphovascular invasion (LVI) and perineural invasion (PNI) further indicates a lower risk of spread beyond the primary site. The TMN stage is typically low, with the tumor confined to the uterus and no involvement of regional lymph nodes or distant organs. The inflammatory response is mild, and the stromal reaction is minimal, suggesting a tumor that is less aggressive and more likely to be successfully treated with standard therapeutic approaches.","A medium survival risk in Uterine Corpus Endometrial Carcinoma typically presents with intermediate features in WSIs. The tumor may be of moderate grade, with cells showing some degree of nuclear atypia and mitotic activity but still retaining some normal architecture. Tumor size is variable, but usually not as large as in cases with higher risk. There may be partial myometrial invasion, and the tumor margins might appear somewhat irregular but not extensively infiltrative. The presence of lymphovascular invasion (LVI) or perineural invasion (PNI) may be noted, but they are less pronounced or only focal. The TMN stage is likely to be in an intermediate range, with some involvement of lymph nodes possible but not extensive. The inflammatory response and stromal reaction are present but not as intense as in higher-risk cases, indicating a tumor that is moderately aggressive but with some potential for control.","Higher survival risk in Uterine Corpus Endometrial Carcinoma is associated with more aggressive tumor features. The WSIs typically show a high-grade tumor with poorly differentiated cells, significant nuclear atypia, and abnormal mitotic figures. The tumor is often large and exhibits deep myometrial invasion. The presence of lymphovascular invasion (LVI) and perineural invasion (PNI) are also common indicators of a higher survival risk, suggesting that the cancer cells have a greater potential to spread. Additionally, WSIs may show an advanced TMN stage, particularly higher T stages (indicating tumor size and invasion depth) and possible involvement of regional lymph nodes or distant metastases. Necrosis within the tumor and a pronounced inflammatory and stromal response further contribute to a higher survival risk, indicating a more aggressive and potentially resistant tumor environment."
GBMLGG,"A low survival risk in Glioblastoma multiforme (GBM) and Brain Lower Grade Glioma (LGG) can be indicated by the presence of features such as lower tumor grade with less aggressive histological patterns, smaller tumor size, and the absence of necrosis or minimal necrotic areas within the tumor. The presence of well-differentiated tumor cells with minimal nuclear atypia, lower mitotic index, and the absence of lymphovascular invasion (LVI) or perineural invasion (PNI) are also key indicators. Additionally, the absence of significant immune cell infiltration and a lack of extensive tumor necrosis contribute to a higher survival risk. The TMN stage is typically lower, with tumors confined to the primary site without significant local or distant spread.","A medium survival risk in Glioblastoma multiforme (GBM) and Brain Lower Grade Glioma (LGG) is often associated with intermediate tumor grades where there is a moderate level of cellular atypia and mitotic activity. The tumor size may be moderate, with some evidence of infiltration into surrounding brain tissue, though it remains relatively localized. There may be areas of necrosis, but these are typically limited in extent. Tumors may exhibit mild to moderate lymphovascular invasion (LVI) and perineural invasion (PNI), contributing to an increased risk but not as severe as in higher-risk cases. The TMN stage is generally intermediate, indicating some degree of local spread but without extensive metastasis. The immune response within the tumor microenvironment is moderate, with a balanced presence of inflammatory cells and stromal reaction.","A higher survival risk in Glioblastoma multiforme (GBM) and Brain Lower Grade Glioma (LGG) is typically indicated by high tumor grades, with poorly differentiated and highly atypical cells. These tumors often exhibit large sizes with extensive infiltration into surrounding brain tissues, and there are usually significant areas of necrosis within the tumor. The presence of prominent lymphovascular invasion (LVI) and perineural invasion (PNI) further exacerbates the survival risk, as these features are linked to more aggressive disease. Tumor margins are often infiltrative and poorly defined, with widespread destruction of normal brain architecture. The TMN stage is advanced, with evidence of both local and distant spread. There is typically an intense inflammatory response and stromal reaction, indicating a highly active tumor microenvironment that correlates with poor prognosis."